"Job_Title","Skills"
"Leasing Agent","leasing commercial real estate tenant landlord lease negotiation crm market prospecting tours"
"Property Appraiser","real estate appraisal comparable sales income approach cost approach fnma fha inspection reporting"
"Tax Manager","tax corporate tax income tax deferred tax transfer pricing international tax excel onesource corptax erp"
"Internal Auditor","internal audit sox risk based audit internal controls cia cisa data analytics excel acl"
"External Auditor","external audit gaap ifrs sox audit planning audit testing internal controls cpa working papers"
"FP&A Manager","fp&a financial planning analysis budget forecast variance analysis financial modeling excel power bi"
"Revenue Accountant","revenue recognition asc 606 ifrs 15 saas subscription contract deferred revenue excel erp netsuite"
"Cost Accountant","cost accounting standard cost variance analysis inventory bill of materials erp sap excel manufacturing"
"Payroll Manager","payroll adp workday ultipro garnishments tax withholding w-2 compliance benefits state taxes excel"
"AP Manager","accounts payable invoice processing three-way match vendor management erp sap oracle month end close"
"AR Manager","accounts receivable collections cash application aging erp sap oracle credit billing month end close"
"Consolidations Accountant","consolidations financial reporting intercompany foreign currency gaap ifrs hyperion onestream hfm excel"
"SOX Compliance Manager","sox sarbanes-oxley internal controls audit risk assessment narratives testing deficiency remediation cpa"
"Fund Accountant","fund accounting nav net asset value hedge fund private equity aum reconciliation bloomberg excel"
"Real Estate Accountant","real estate accounting yardi appfolio mri lease accounting asc 842 cap rate noi depreciation gaap"
"IFRS Specialist","ifrs gaap ifrs 15 ifrs 16 ifrs 9 ifrs 17 technical accounting financial statements disclosure audit"
"IT Director","it strategy infrastructure budget vendor management team leadership enterprise architecture security"
"CIO","cio it strategy digital transformation board budget security cloud innovation technology roadmap talent"
"IT Architect","it architecture enterprise architecture solution design infrastructure cloud integration security roadmap"
"Network Administrator","networking cisco tcp/ip routing switching vlan vpn firewall dns dhcp windows server linux monitoring"
"IT Support Manager","it support helpdesk itsm itil servicenow sla kpi windows active directory office 365 budget"
"ERP Implementation Consultant","erp sap oracle dynamics implementation project management requirements configuration testing change management"
"SAP Consultant","sap s4hana sd mm fi co ps hcm abap configuration cutover training support blueprint"
"Oracle ERP Consultant","oracle oracle cloud oracle ebs finance supply chain hcm configuration implementation integration sql"
"Dynamics 365 Consultant","dynamics 365 d365 f&o bc crm power platform configuration implementation customization integration"
"IT Change Manager","it change management itsm itil change advisory board risk assessment change requests servicenow"
"Business Continuity Manager","business continuity bcp disaster recovery rto rpo risk assessment testing crisis incident iso 22301"
"Data Center Manager","data center infrastructure server storage networking cooling power monitoring sla capacity planning"
"Virtualization Engineer","vmware vsphere esxi vsan nsx hyper-v kvm proxmox performance migration backup veeam disaster recovery"
"Storage Engineer","storage san nas netapp emc pure storage fiber channel iscsi nfs backup veeam capacity planning"
"Backup Administrator","backup veeam commvault veritas azure backup recovery rto rpo testing tape deduplication replication"
"Endpoint Management","endpoint management sccm intune jamf windows macos patch management software deployment mdm compliance"
"Identity Management","identity management active directory azure ad okta ping identity sailpoint sso saml ldap provisioning"
"Collaboration Engineer","microsoft teams slack zoom sharepoint confluence exchange o365 google workspace audio visual"
"Supply Chain Director","supply chain logistics operations strategy vendor management erp sap kpi budget team leadership"
"Inventory Control Manager","inventory control cycle counting erp sap oracle wms abc analysis kpi shrinkage accuracy"
"Demand Planner","demand planning s&op statistical forecasting erp sap oracle demantra apics excel kpi accuracy"
"Sourcing Manager","strategic sourcing procurement rfq rfp vendor selection negotiation contract tco sap ariba spend"
"Import Export Manager","import export customs incoterms letter of credit compliance hs codes cbp trade compliance freight"
"3PL Manager","3pl warehouse distribution transportation kpi sla vendor management wms erp tms contract"
"Last Mile Delivery Manager","last mile delivery routes fleet tracking customer experience kpi returns sla technology ops cost"
"Cold Chain Manager","cold chain temperature controlled pharma logistics food safety refrigerated gdp gmp validation"
"Reverse Logistics Manager","reverse logistics returns refurbishment recycling disposal erp kpi vendor compliance sustainability"
"Shipping Coordinator","shipping freight carrier tracking documentation customs incoterms erp excel coordination customer service"
"Hotel General Manager","hotel management revenue operations food beverage housekeeping budget staffing guest satisfaction"
"Revenue Manager","revenue management hotel pricing distribution ota pms channel manager str revpar adr occupancy"
"Food Beverage Director","food beverage restaurant catering banquet menu cost control staffing beverage inventory haccp"
"Front Desk Manager","front desk hotel reservations pms opera guest relations check-in check-out complaints training"
"Housekeeping Manager","housekeeping rooms cleanliness inspection staff scheduling linen laundry safety cost control pms"
"Catering Manager","catering events banquet menu planning food safety staffing budgeting client relations venue"
"Spa Manager","spa wellness treatments scheduling retail revenue staffing training client experience budget beauty"
"Concierge","concierge guest services recommendations reservations hotel local knowledge transportation vip customer service"
"Hotel Sales Manager","hotel sales corporate accounts group sales rfp negotiation revenue crm site visits meeting planner"
"Wellness Director","wellness employee programs mental health fitness nutrition stress management biometrics benefits roi"
"Health Coach","health coaching nutrition fitness behavior change goal setting motivational interviewing client assessment"
"Nutritionist","nutrition clinical diet meal planning counseling supplements eating disorders diabetes weight management"
"Group Fitness Instructor","group fitness aerobics spinning zumba hiit strength training yoga pilates certification class planning"
"Pilates Instructor","pilates mat reformer cadillac anatomy alignment cueing modifications rehabilitation certification"
"Swim Coach","swimming technique program design drills race strategy periodization video analysis competitive certification"
"Strength Conditioning Coach","strength conditioning cscs program design periodization olympic lifting squat monitoring athlete management"
"Sports Nutritionist","sports nutrition performance energy systems macros hydration supplementation body composition athlete"
"TikTok Content Creator","tiktok short form video content strategy editing viral engagement audience growth brand deals ugc"
"Instagram Manager","instagram reels stories content creation canva hashtag strategy engagement influencer analytics"
"YouTube Creator","youtube video production premiere pro seo thumbnails analytics monetization audience retention sponsorship"
"LinkedIn Marketing Specialist","linkedin b2b content strategy company page employee advocacy ads lead gen forms analytics"
"Discord Community Manager","discord community management moderation bots server setup engagement events web3 gaming member growth"
"Newsletter Writer","newsletter email substack beehiiv mailchimp writing audience growth sponsorship open rate click rate"
"Meme Creator","content creation social media humor photoshop canva engagement viral brand tiktok instagram twitter"
"Brand Storyteller","storytelling brand narrative content strategy writing video social media campaign customer stories"
"Event Coordinator","event coordination planning logistics vendor management budget registration venue av catering timeline"
"Conference Producer","conference event production programming speakers sponsors registration marketing logistics venue"
"Exhibition Manager","exhibition trade show booth logistics shipping setup breakdown budget vendor marketing lead generation"
"Experiential Marketing Manager","experiential marketing brand activation events pop up immersive consumer engagement social roi"
"Wedding Planner","wedding planning vendors budget timelines florals catering venue decor day coordination client management"
"Corporate Event Manager","corporate events meetings incentives conferences exhibitions mice venue catering budget logistics av"
"Cosmetic Chemist","cosmetic chemistry formulation skincare haircare stability safety regulatory fda eu cosmetics testing"
"Esthetician","esthetics skincare facials waxing chemical peels microdermabrasion client consultation retail license"
"Hairstylist","hair cutting coloring styling client consultation retail wella loreal balayage highlights keratin license"
"Makeup Artist","makeup artistry bridal editorial film television sfx airbrush client consultation color theory hygiene"
"Beauty Brand Manager","beauty brand management product development marketing retail e-commerce trend consumer insights p&l"
"Nail Technician","nail technician manicure pedicure acrylic gel nail art client service sanitation license booking"
"Veterinarian","veterinary dvm diagnosis treatment surgery anesthesia emergency radiology laboratory pharmacology"
"Veterinary Surgeon","veterinary surgery soft tissue orthopedic minimally invasive anesthesia post operative specialty referral"
"Zoo Veterinarian","zoo medicine exotic wildlife capture immobilization diagnostics research conservation husbandry"
"Equine Veterinarian","equine horse lameness reproduction dentistry diagnostic imaging emergency sport horse ambulatory"
"Veterinary Radiologist","veterinary radiology x-ray ct mri ultrasound fluoroscopy interpretation pacs board certified"
"Librarian","library science cataloging classification marc collection development reference services information literacy"
"Research Librarian","research support subject librarianship literature review databases citation management zotero scholarly"
"Archivists","archives preservation digitization finding aids provenance arrangement description metadata ead dams"
"Digital Librarian","digital library institutional repository digital preservation metadata dublincore dspace islandora"
"School Librarian","school library information literacy reading promotion collection development technology curriculum"
"Translator","translation localization cat tools trados memoq terminology translation memory quality assurance"
"Interpreter","interpretation consecutive simultaneous conference court medical legal remote interpreting certification"
"Localization Manager","localization l10n internationalization translation cat tools trados project management vendors quality"
"Language Teacher","language teaching esl tesol tefl curriculum lesson planning assessment grammar pronunciation fluency"
"Fashion Stylist","fashion styling editorial commercial wardrobe shopping trends brand lookbook fashion week collaboration"
"Fashion Buyer","fashion buying merchandise planning trend analysis vendor management purchasing open to buy margin retail"
"Textile Designer","textile design pattern design print color weave knit cad adobe illustrator surface design manufacturing"
"Costume Designer","costume design theatre film research sketching construction wardrobe period collaboration budget fittings"
"Retail Visual Merchandiser","visual merchandising retail display planogram window brand styling props trend store layout photography"
"Historic Preservation Specialist","historic preservation survey national register section 106 habs architectural history documentation"
"Green Building Consultant","green building leed well passive house energy modeling sustainability carbon materials certification"
"Real Estate Development Analyst","real estate development pro forma financial modeling npv irr land acquisition zoning entitlement"
"Code Compliance Inspector","building code ibc irc fire code accessibility ada permit inspection compliance plan review"
"Facilities Planner","facilities planning space planning programming bim revit autocad workplace move management cad"
"Media Buyer","media buying programmatic display video social search tv radio out of home negotiation trafficking"
"Media Planner","media planning strategy audience channels budget reach frequency grp trp targeting analytics campaign"
"Programmatic Trader","programmatic dsp ssp rtb dmp audience targeting bid management campaign optimization analytics"
"Paid Social Specialist","facebook ads meta ads instagram tiktok linkedin twitter snapchat paid social creative audience roas"
"Out of Home Planner","out of home ooh dooh digital billboard transit placement targeting impressions market negotiation"
"Case Manager","case management care coordination discharge planning insurance authorization utilization review ehr"
"Clinical Coordinator","clinical coordination scheduling patient flow ehr documentation quality compliance staff coordination"
"Patient Advocate","patient advocacy navigation insurance appeals billing compliance communication hipaa resources education"
"Health Education Specialist","health education program development community health health promotion behavioral change training ches"
"Infection Control Nurse","infection control prevention surveillance hai cdc joint commission isolation sterilization audits policy"
"Nurse Educator","nursing education curriculum clinical simulation accreditation evaluation evidence based staff development"
"Risk Manager Healthcare","healthcare risk management patient safety incident reporting root cause analysis fmea insurance compliance"
"Healthcare Administrator","healthcare administration operations budget compliance regulatory staff management strategy quality"
"Medical Affairs Manager","medical affairs medical science liaison key opinion leader clinical data publications advisory board"
"Health Policy Analyst","health policy aca medicare medicaid cms reimbursement regulatory research legislation stakeholder"
"Dental Office Manager","dental office management scheduling billing insurance staffing compliance hipaa patient relations"
"Dental Hygienist","dental hygiene prophylaxis scaling root planing radiograph patient education periodontal rdh license"
"Prosthodontist","prosthodontics dentures implants crowns bridges occlusion aesthetics full mouth rehabilitation"
"Endodontist","endodontics root canal cbct microsurgery retreatment post crown pain management diagnosis imaging"
"Periodontist","periodontics gum disease scaling root planing osseous surgery implants grafting laser maintenance"
"Reliability Centered Maintenance Engineer","rcm fmea fmeca maintenance strategy failure analysis predictive maintenance vibration thermography"
"Safety Engineer","safety engineering hazop pha fmea fault tree risk assessment osha process safety atex iec 61508"
"Automation Controls Engineer","automation plc scada hmi allen bradley siemens rockwell ladder logic function block robotics vision"
"Instrumentation Controls Engineer","instrumentation control systems pid dcs plc field instruments calibration loop tuning p&id safety"
"Validation Engineer","validation iq oq pq gmp fda csv computer system validation protocol report change control pharmaceutical"
"Metrology Engineer","metrology measurement calibration cmm gd&t tolerance uncertainty iso 17025 nist standards inspection"
"Failure Analysis Engineer","failure analysis root cause metallurgy sem tem eds optical microscopy fractography corrosion fatigue"
"NVH Engineer","nvh noise vibration harshness acoustic vibration fft matlab ansys modal analysis damping measurement"
"Calibration Technician","calibration instruments measurement iso 17025 traceable uncertainty certificate laboratory standards quality"
"Viticulturist","viticulture winery vineyard grapevine soil irrigation disease harvest wine quality precision viticulture"
"Horticulturist","horticulture plant science propagation irrigation pest management landscape greenhouse soil crop production"
"Soil Scientist","soil science soil survey field sampling gis mapping soil health carbon remediation fertility usda"
"Animal Nutritionist","animal nutrition feed formulation livestock poultry ruminant swine ration balancing supplements research"
"Crop Consultant","agronomy crop scouting pest management weed control fertility yield soil sampling precision agriculture"
"Food Quality Manager","food quality haccp iso 22000 gmp spc sensory laboratory food safety audit supplier regulatory"
"Brewing Scientist","brewing fermentation yeast hops malt analytical chemistry quality control sensory process optimization"
"ESG Analyst","esg environmental social governance sustainability reporting gri sasb tcfd carbon footprint climate risk"
"Carbon Analyst","carbon accounting ghg protocol scope 1 scope 2 scope 3 net zero carbon credits lifecycle assessment"
"Circular Economy Specialist","circular economy waste reduction product design material flows recycling regenerative take back"
"Environmental Health Safety Manager","ehs environmental health safety osha iso 14001 iso 45001 incident investigation training audit"
"Climate Change Analyst","climate change climate risk scenario analysis tcfd carbon adaptation mitigation policy research"
"Water Resource Engineer","water resources hydrology hydraulics hec-ras swmm gis flood modeling groundwater stormwater permit"
"Remediation Specialist","remediation contaminated site phase i phase ii groundwater soil in-situ ex-situ epa regulatory"
"Waste Management Specialist","waste management solid waste hazardous waste recycling landfill composting regulatory compliance epa"
"Legislative Assistant","legislative policy research bill drafting constituent government stakeholder analysis communications"
"Grant Manager","grant management federal grants state grants rfp application compliance reporting budget monitoring"
"Public Information Officer","public information communications media relations press release social media crisis government writing"
"City Planner","city planning zoning land use entitlement comprehensive plan gis community engagement permitting"
"Code Enforcement Officer","code enforcement zoning building code inspection citation compliance investigation documentation permit"
"Elections Administrator","elections voter registration voting ballot polling place election law compliance reporting"
"Transportation Planner","transportation planning traffic transit bicycle multimodal travel demand model gis policy community"
"Digital Transformation Consultant","digital transformation strategy roadmap cloud data automation change management stakeholder erp"
"Process Improvement Consultant","process improvement lean six sigma value stream mapping kaizen rpa automation kpi change management"
"Organizational Design Consultant","organizational design structure spans layers role clarity efficiency change management stakeholder"
"Supply Chain Consultant","supply chain consulting operations lean six sigma inventory sourcing logistics erp sap data analysis"
"Finance Transformation Consultant","finance transformation fp&a close optimization shared services erp sap oracle automation kpi"
"Technology Strategy Consultant","technology strategy digital cloud data ai roadmap architecture innovation vendor selection business case"
"Cyber Risk Consultant","cyber risk risk assessment maturity assessment nist iso 27001 penetration testing red team remediation"
"Healthcare Consulting Manager","healthcare consulting strategy operations clinical revenue cycle ehr change management analytics"
"Private Equity Operating Partner","private equity portfolio operations value creation lean go to market digital transformation exit board"
"Transaction Advisory Analyst","transaction advisory financial due diligence quality of earnings excel financial modeling m&a"
"NFT Artist","nft digital art generative art opensea smart contract ethereum ipfs photoshop procreate pixel art"
"DAO Coordinator","dao governance voting snapshot discourse multisig community tokenomics proposal treasury management"
"Crypto Analyst","cryptocurrency bitcoin ethereum defi technical analysis on-chain glassnode dune analytics nansen"
"Web3 Community Manager","web3 discord twitter community nft dao engagement moderation events governance holders ambassador"
"DeFi Analyst","defi yield farming liquidity tvl protocol uniswap aave compound curve tokenomics risk smart contract"
"Construction Technology Manager","construction technology bim procore plangrid autodesk drones lidar reality capture digital construction"
"Smart Building Engineer","smart building iot bms building management system hvac lighting control access control bacnet integration"
"Real Estate Technology Manager","proptech crm mls yardi appfolio mri digital marketing data analytics automation process improvement"
"Actuarial Data Scientist","actuarial machine learning python r glm gradient boosting pricing reserving telematics claims"
"Underwriting Analyst","underwriting risk assessment pricing loss ratio cat modeling rms air excel policy premium reinsurance"
"Claims Analyst","claims investigation settlement reserve litigation negotiation subro fraud analytics sql excel reporting"
"E-Discovery Manager","e-discovery relativity nuix review processing culling production litigation legal hold evidence"
"Legal Operations Manager","legal operations clm contract lifecycle management billing budget vendor management metrics technology"
"Legal Project Manager","legal project management litigation matter management budget timeline stakeholder legal technology"
"Talent Agent","talent management booking contract negotiation entertainment film tv music representation deal making"
"Entertainment Lawyer","entertainment law film music tv contracts ip licensing royalties talent negotiation guild"
"Music Licensing Manager","music licensing sync publishing royalties clearance broadcast film tv advertising catalog negotiations"
"Sports Agent","sports agent contract negotiation nba nfl mlb nhl endorsements athlete representation salary cap"
"Game Producer","game production project management agile scrum milestone budget unity unreal team coordination qa"
"Film Producer","film production development financing budget scheduling post distribution rights talent crew deliverables"
"Casting Director","casting auditions actors roles creative vision negotiation director database avid breakdown union"
"Chief AI Officer","ai strategy llm generative ai governance ethics responsible ai roadmap board organizational change"
"Chief Data Officer","data strategy data governance data quality data engineering analytics ml privacy compliance board"
"Chief Digital Officer","digital transformation strategy digital products innovation technology cloud data agile change management"
"Chief Sustainability Officer","sustainability esg carbon net zero circular economy supply chain reporting board regulation stakeholder"
"Head of AI","ai strategy machine learning llm generative ai roadmap team leadership research product ethics governance"
"AI Ethics Researcher","ai ethics responsible ai bias fairness transparency explainability privacy governance policy research"
"Chief Revenue Officer","revenue growth sales marketing customer success go-to-market board investor strategy team leadership"
"Chief Customer Officer","customer experience cx customer success nps csat retention journey mapping voice of customer strategy"
"EdTech Product Manager","edtech learning management product strategy k-12 higher education student outcomes accessibility roadmap"
"Online Course Creator","online learning instructional design lms articulate camtasia video production curriculum udemy teachable"
"Learning Experience Designer","learning experience design lxd instructional design ux accessibility lms engagement gamification evaluation"
"Education Data Analyst","education analytics student data sql tableau power bi assessment outcomes equity reporting policy"
"Digital Health Product Manager","digital health healthtech ehr patient engagement mobile health mhealth wearables fda hipaa product roadmap"
"Telehealth Operations Manager","telehealth virtual care operations scheduling patient flow technology compliance hipaa staff kpi"
"Clinical Informatics Analyst","clinical informatics ehr epic hl7 fhir data analytics clinical decision support workflow training"
"Plastic Surgeon","plastic surgery aesthetics rhinoplasty breast augmentation liposuction reconstruction microsurgery facelift"
"Dermatology NP","dermatology nurse practitioner skin biopsy cosmetic laser injectables botox filler acne prescribing ehr"
"Medical Aesthetician","medical aesthetics facials chemical peels microneedling laser skincare consultation retail license"
"Aesthetic Nurse","aesthetic nursing botox fillers prp laser kybella patient consultation facial anatomy injections rn"
"Defense Systems Engineer","defense systems mbse sysml requirements integration test verification mil-spec dod clearance"
"Space Mission Analyst","space mission orbital mechanics astrodynamics systems engineering satellite launch vehicle stk matlab"
