"Job_Title","Skills"
"Pharmacist","pharmacy dispensing medications pharmacokinetics drug interaction patient counseling ehr clinical pharmacy bcps"
"Physical Therapist","physical therapy musculoskeletal rehabilitation exercise therapy manual therapy injury prevention biomechanics"
"Occupational Therapist","occupational therapy activities of daily living rehabilitation sensory integration adaptive equipment"
"Speech Language Pathologist","speech language pathology communication disorders dysphagia articulation language development aac aphasia"
"Radiologic Technologist","radiologic technology x-ray ct mri fluoroscopy radiation safety patient positioning pacs arrt"
"Medical Laboratory Scientist","clinical laboratory hematology chemistry microbiology immunology molecular diagnostics pcr quality control lims"
"Respiratory Therapist","respiratory therapy mechanical ventilation intubation pulmonary function oxygen cpap bipap ards icu"
"Surgical Technologist","surgical tech sterile technique instrument surgical procedure scrub draping counting autoclave operating room"
"Medical Coder","medical coding icd-10 cpt hcpcs medical billing ehr epic compliance reimbursement cpc ccs"
"Clinical Research Coordinator","clinical research clinical trials irb gcp protocol informed consent data collection adverse event fda"
"Biostatistician","biostatistics r sas stata clinical trials survival analysis regression mixed models power analysis"
"Medical Writer","medical writing clinical study report regulatory submission fda ich guidelines scientific writing"
"Health Informatics Specialist","health informatics ehr epic hl7 fhir interoperability clinical data sql analytics healthcare it"
"Telemedicine Physician","telemedicine telehealth virtual care primary care diagnosis treatment ehr state licensure"
"Public Health Analyst","public health epidemiology biostatistics surveillance data analysis r stata community health health policy"
"Health Economist","health economics pharmacoeconomics cost effectiveness markov model qaly heor sas r reimbursement hta"
"Licensed Clinical Social Worker","social work lcsw therapy counseling case management assessment intervention mental health documentation"
"Marriage Family Therapist","marriage family therapy couples counseling family therapy cbt attachment gottman emdr trauma licensure"
"Substance Abuse Counselor","substance abuse addiction recovery cbt motivational interviewing 12 step detox group therapy case management"
"Behavioral Health Technician","behavioral health aba applied behavior analysis autism dbt skills crisis intervention documentation"
"Pharmaceutical Scientist","drug discovery medicinal chemistry pharmacology formulation preclinical in vitro assay development hts"
"Clinical Pharmacologist","clinical pharmacology pharmacokinetics pharmacodynamics clinical trials nda fda dose bioavailability"
"Regulatory Affairs Specialist","regulatory affairs fda ema ich 510k pma nda bla dossier submission compliance quality cmc"
"Quality Assurance Scientist","quality assurance gmp gcp glp iso 13485 validation sop capa deviation oos fda audit"
"Clinical Data Manager","clinical data management cdms medidata rave oracle clinical edc data validation coding meddra"
"Bioinformatician","bioinformatics python r perl ngs genomics transcriptomics variant calling blast bwa"
"Biomedical Engineer","matlab labview medical devices fda iec 62304 iso 14971 signal processing ecg biomechanics"
"Formulation Scientist","drug formulation solid dosage oral injectable excipient stability dissolution gmp doe"
"Process Development Scientist","process development upstream downstream cell culture bioreactor purification chromatography scale up gmp"
"Mechanical Engineer","solidworks catia autocad ansys matlab cad fea cfd tolerancing gd&t manufacturing cnc lean six sigma"
"Thermal Engineer","heat transfer cfd ansys fluent matlab thermodynamics thermal management cooling heat sink simulation"
"Manufacturing Engineer","manufacturing cnc lean manufacturing six sigma jig fixture solidworks quality gd&t process improvement"
"Product Design Engineer","solidworks catia product design cad fea tolerancing prototype testing material selection injection molding"
"Mechatronics Engineer","mechatronics embedded c matlab simulink plc scada motor control sensors pid control systems automation"
"HVAC Engineer","hvac cooling heating ventilation autocad revit mep chiller ahu heat exchanger energy simulation ashrae"
"Piping Engineer","piping p&id isometric stress analysis caesar ii autocad asme pressure vessel material selection valve"
"Reliability Engineer","reliability fmea fta weibull maintainability rcm root cause analysis sop kpi predictive maintenance"
"Civil Engineer","autocad revit civil 3d staad structural analysis soil mechanics geotechnical bim construction management leed"
"Structural Engineer","staad etabs sap2000 structural analysis steel concrete foundation seismic wind load cad drawing"
"Geotechnical Engineer","geotechnical soil mechanics foundation pile retaining wall slope stability settlement laboratory bore hole"
"Transportation Engineer","transportation traffic engineering highway design intersection traffic modeling vissim synchro autocad"
"Environmental Engineer","environmental engineering wastewater drinking water air quality solid waste remediation epa regulatory"
"Construction Manager","construction management project management scheduling primavera budget subcontractor rfi safety osha"
"Site Engineer","site supervision construction quality control rfi safety autocad surveying measurement inspection"
"Cost Estimator","cost estimation quantity surveying boq takeoff bid tender pricing excel planswift construction"
"BIM Manager","bim revit autocad navisworks coordination clash detection 4d bim ifc project management lod"
"Electrical Engineer","altium kicad pcb circuit simulation spice matlab power electronics plc scada fpga verilog control systems"
"Power Systems Engineer","power systems load flow fault analysis protection relay substation transmission distribution scada pss/e"
"Control Systems Engineer","control systems pid controller matlab simulink plc scada hmi automation ladder logic iec 61131 dcs"
"RF Engineer","rf radio frequency antenna microwave high frequency pcb matching network ads cst hfss spectrum analyzer"
"Power Electronics Engineer","power electronics converter inverter pwm mosfet igbt gate driver battery management ev solar energy storage"
"Instrumentation Engineer","instrumentation measurement sensors transmitters plc scada dcs calibration p&id fieldbus"
"Test Engineer","test engineering test equipment oscilloscope labview python automation characterization validation"
"Chemical Engineer","aspen plus hysys matlab process simulation thermodynamics heat transfer mass transfer hazop safety gmp"
"Process Engineer","process engineering p&id hazop aspen plus piping pressure vessel heat exchanger safety commissioning"
"Chemical Process Operator","process operations dcs scada p&id safety shift work sampling quality control maintenance hazardous materials"
"Polymer Scientist","polymer science synthesis characterization rheology extrusion injection molding gpc dsc tga formulation"
"Materials Scientist","materials science characterization sem tem xrd mechanical testing metallurgy composites failure analysis"
"Aerospace Engineer","cfd ansys fluent matlab flight dynamics structural analysis composite do-178 systems engineering stk"
"Systems Engineer","systems engineering mbse cameo sysml requirements architecture verification validation se process"
"Flight Test Engineer","flight test test planning data acquisition telemetry flight dynamics matlab python performance certification"
"Propulsion Engineer","propulsion turbomachinery combustion gas turbine rocket nozzle cfd ansys matlab thermodynamics testing"
"Environmental Scientist","gis arcgis environmental assessment field sampling ecology water quality contamination remediation"
"Environmental Consultant","environmental consulting eia phase i phase ii remediation permitting epa regulatory soil groundwater"
"Sustainability Manager","sustainability esg carbon footprint greenhouse gas ghg protocol lifecycle assessment iso 14001 net zero"
"Climate Scientist","climate modeling gcm python r netcdf gis atmospheric science oceanography remote sensing ipcc"
"Hydrologist","hydrology gis arcgis swmm hec-hms hec-ras groundwater field work water quality flood modeling"
"Operations Manager","operations management lean six sigma kaizen kpi budget erp sap quality process improvement"
"Supply Chain Manager","supply chain logistics erp sap demand planning s&op inventory procurement strategic sourcing 3pl lean"
"Procurement Manager","procurement strategic sourcing rfq rfp negotiation vendor management sap ariba cost reduction"
"Warehouse Manager","warehouse management wms inventory picking packing shipping kpi safety 5s lean erp sap forklift"
"Quality Manager","quality management iso 9001 iso 13485 gmp capa audit inspection spc six sigma lean fmea"
"Lean Engineer","lean manufacturing six sigma kaizen value stream mapping 5s kanban oee continuous improvement tpm"
"Industrial Engineer","industrial engineering lean six sigma time study ergonomics plant layout simulation process improvement"
"Plant Manager","plant management manufacturing operations lean safety budget workforce kpi erp quality production"
"Production Planner","production planning mrp erp sap demand forecasting inventory scheduling bill of materials supply chain"
"Maintenance Manager","maintenance management predictive preventive maintenance cmms sap pm reliability fmea rcm safety kpi"
"Teacher","lesson planning curriculum design assessment classroom management student engagement lms google classroom"
"University Professor","research teaching publications peer review grant writing curriculum development phd advising"
"School Principal","school leadership curriculum staff management student outcomes community engagement budget policy"
"Instructional Designer","instructional design e-learning lms articulate storyline captivate scorm blended learning"
"Education Technology Specialist","edtech lms canvas blackboard google classroom data analytics student outcomes training instructional design"
"School Counselor","school counseling college counseling social emotional learning college readiness crisis intervention 504 iep"
"Special Education Teacher","special education iep 504 plan differentiated instruction behavior management autism learning disability"
"ESL Teacher","esl english as second language tefl tesol language acquisition curriculum lesson planning ell"
"Tutor","tutoring academic support math science english reading writing sat act test prep"
"Academic Advisor","academic advising degree planning graduation requirements registration career counseling retention"
"Training Specialist","corporate training l&d lms facilitation instructional design e-learning needs assessment evaluation"
"Attorney","legal law litigation contracts corporate law intellectual property employment law compliance research trial"
"Corporate Lawyer","corporate law m&a securities governance transactions due diligence contracts compliance sec filings"
"Litigation Attorney","litigation civil trial arbitration mediation discovery deposition motion brief appellate expert witness"
"Employment Lawyer","employment law discrimination harassment wrongful termination wage hour flsa fmla ada title vii"
"Intellectual Property Attorney","intellectual property patent trademark copyright trade secret licensing prosecution litigation ip strategy"
"Compliance Officer","compliance regulatory risk management audit policy kyc aml gdpr hipaa sox training"
"Paralegal","legal research drafting filing discovery deposition contract review westlaw lexisnexis case management"
"Legal Counsel","legal counsel contracts negotiation corporate law intellectual property employment compliance regulatory"
"Contract Manager","contract management drafting negotiation review procurement vendor sow nda master service agreement"
"Data Privacy Lawyer","data privacy gdpr ccpa privacy law data protection dpia consent data breach regulatory cipp"
"Research Scientist","research experimental design data analysis python r matlab publications peer review grant writing"
"Biologist","biology cell culture molecular biology pcr western blot elisa microscopy flow cytometry data analysis"
"Biochemist","biochemistry protein enzyme assay western blot pcr mass spectrometry hplc cell culture molecular biology"
"Chemist","analytical chemistry synthesis hplc nmr mass spectrometry titration spectroscopy method development gmp"
"Physicist","physics quantum mechanics simulation matlab python data analysis optics laser experimental publications"
"Geologist","geology gis arcgis remote sensing field work sampling stratigraphy petrology mineralogy seismic"
"Astronomer","astronomy astrophysics telescope imaging spectroscopy python astropy data reduction publications nasa"
"Marine Biologist","marine biology field work scuba sampling species identification ecology oceanography gis data analysis"
"Statistician","statistics r python sas stata regression anova bayesian experimental design monte carlo simulation"
"Psychologist","psychology cbt dbt assessment diagnosis mental health research publications supervision clinical"
"Epidemiologist","epidemiology biostatistics r stata clinical trials cohort study systematic review meta analysis surveillance"
"Neuroscientist","neuroscience electrophysiology eeg fmri python matlab data analysis animal models publications"
"Geneticist","genetics genomics ngs variant calling python r bioinformatics crispr pcr gwas population genetics"
"Policy Analyst","policy research legislation government stakeholder analysis cost benefit analysis report writing"
"Urban Planner","gis arcgis land use zoning transportation planning environmental review community engagement sustainability"
"Government Affairs Manager","government affairs lobbying regulatory legislation policy advocacy coalition stakeholder reporting"
"Intelligence Analyst","intelligence analysis osint geospatial reporting databases threat assessment python sql"
"Foreign Service Officer","foreign policy diplomacy government international relations language analysis reporting negotiation"
"Social Worker","social work case management counseling assessment intervention mental health child welfare documentation"
"Probation Officer","probation case management risk assessment supervision court compliance reporting substance abuse"
"Architect","revit autocad sketchup bim design development construction documents zoning building code leed sustainability"
"Interior Designer","revit autocad sketchup ff&e space planning lighting design material selection project management leed"
"Landscape Architect","land design autocad revit gis planting design grading drainage construction documents sustainability leed"
"Urban Designer","urban design autocad rhino gis zoning master plan public space pedestrian transit sustainability"
"Interior Architect","interior architecture revit autocad space planning ff&e bim construction documents building code ada"
"Graphic Designer","photoshop illustrator indesign figma brand identity typography logo design color theory print digital"
"Illustrator","illustration procreate adobe illustrator photoshop character design concept art editorial digital art"
"Art Director","art direction creative concept brand campaigns team management photoshop illustrator indesign typography"
"Creative Director","creative strategy brand campaigns team leadership concept development art direction design presentations"
"Copywriter","copywriting brand voice advertising campaigns digital social media email landing page seo headlines"
"Content Creator","content creation video youtube instagram tiktok editing premiere pro canva social media analytics"
"Video Editor","video editing premiere pro final cut after effects davinci resolve color grading sound design"
"Photographer","photography lightroom photoshop studio lighting composition portrait wedding commercial retouching"
"Videographer","videography camera premiere pro final cut after effects lighting color grading drone documentary"
"Film Director","directing cinematography screenplay production storyboard editing sound design vfx color grading budget"
"Animator","animation after effects maya blender cinema 4d rigging character animation 2d 3d motion design"
"UX/UI Designer","figma sketch adobe xd wireframing prototyping user research usability design thinking accessibility"
"Fashion Designer","cad clo 3d pattern making draping textile sourcing garment construction tech pack sustainable fashion"
"Industrial Designer","solidworks rhino keyshot alias cad product design ergonomics materials manufacturing prototyping"
"Interior Stylist","interior styling mood board sourcing furniture textiles color palette photography staging client trend"
"Set Designer","set design drafting autocad scenic design prop construction theatre film television budget"
"Journalist","journalism reporting writing editing research sources fact checking seo cms wordpress social media"
"Editor","editing proofreading manuscript publishing content strategy style guide cms wordpress seo"
"Broadcast Journalist","broadcast journalism presenting reporting scriptwriting camera editing live tv radio digital social media"
"Podcast Producer","podcast production audio editing adobe audition logic pro interviews rss distribution spotify"
"Social Media Manager","social media content creation instagram tiktok linkedin twitter canva scheduling hootsuite analytics"
"Content Strategist","content strategy seo editorial content marketing audience brand voice analytics cms hubspot wordpress"
"Hotel Manager","hotel management hospitality front desk housekeeping revenue management occupancy pms operations"
"Restaurant Manager","restaurant management food service food safety haccp inventory cost control staff management pos"
"Chef","culinary arts cooking menu development food safety haccp inventory food cost team management catering"
"Sous Chef","sous chef kitchen management cooking plating food safety inventory scheduling training menu brigade"
"Pastry Chef","pastry baking confectionery plating dessert chocolate bread decorating food safety cost control"
"Barista","coffee espresso latte customer service pos cleanliness milk steaming specialty coffee training"
"Sommelier","wine sommelier beverage management tasting food pairing cellar inventory purchasing hospitality cws"
"Food Safety Manager","food safety haccp servsafe regulatory audit inspection sop training temperature control sanitation"
"Event Manager","event management planning logistics vendor management budget sponsorship marketing venue staffing"
"Travel Agent","travel itinerary booking gds sabre amadeus hotel airline visa customer service packages cruise"
"Tour Guide","tour guiding tourism history culture customer service languages itinerary safety group management"
"Real Estate Agent","mls listings buyer seller negotiation transaction management crm market analysis valuation mortgage"
"Real Estate Developer","real estate development land acquisition zoning construction finance pro forma npv irr investor relations"
"Property Manager","property management lease tenant maintenance rent collection yardi appfolio budget vendor compliance"
"Mortgage Broker","mortgage lending underwriting credit analysis loan origination nmls compliance fannie mae freddie mac"
"Real Estate Analyst","real estate analysis financial modeling pro forma dcf npv irr cap rate noi market research argus"
"Commercial Real Estate Broker","commercial real estate lease sale office retail industrial multifamily market analysis valuation"
"Supply Chain Analyst","supply chain logistics erp sap demand planning inventory procurement rfq lean six sigma excel"
"Logistics Manager","logistics supply chain transportation freight 3pl warehouse distribution tms wms erp import export"
"Fleet Manager","fleet management vehicles maintenance gps tracking telematics fuel driver compliance dot fmcsa"
"Customs Broker","customs brokerage import export tariff hs code cbp compliance documentation freight trade compliance"
"Freight Broker","freight brokerage trucking load board dat carrier shipper negotiation tms dispatch rate lane"
"Air Traffic Controller","air traffic control radar communications tower terminal en route separation navigation faa icao"
"Pilot","flying aircraft faa atpl type rating ifr vfr crm navigation airline charter corporate"
"Ship Captain","maritime navigation seamanship stcw vessel crew management cargo customs port safety imo"
"Agronomist","agronomy crop science soil science fertilization pest management irrigation gis precision agriculture yield"
"Agricultural Engineer","agricultural engineering irrigation drainage farm machinery food processing gis precision agriculture"
"Food Scientist","food science food safety quality control haccp gmp sensory formulation shelf life fda regulatory"
"Winemaker","winemaking viticulture fermentation harvest sensory blending chemistry barrel cellar quality control"
"Brewing Engineer","brewing fermentation quality control chemistry hops malt yeast process engineering packaging haccp"
"Sports Coach","coaching athletic training strength conditioning sport science periodization program design video analysis"
"Personal Trainer","personal training fitness strength training cardio nutrition client assessment program design nasm acsm"
"Athletic Trainer","athletic training injury prevention rehabilitation first aid taping sport medicine ncaa atc"
"Sports Analyst","sports analytics statistics python r data visualization tableau sql performance analysis scouting"
"Fitness Manager","fitness management gym group exercise personal training sales member retention scheduling budget"
"Yoga Instructor","yoga asana pranayama meditation anatomy sequencing cueing alignment certification ryt 200 hour"
"Sports Physiotherapist","sports physiotherapy musculoskeletal rehabilitation manual therapy sports injury athlete return to sport"
"Electrician","electrical installation wiring circuit breaker panel conduit nec osha testing inspection residential commercial"
"Plumber","plumbing pipe installation repair soldering pvc copper gas line water heater code inspection residential"
"HVAC Technician","hvac air conditioning heating ventilation refrigerant epa 608 troubleshooting maintenance installation"
"Welder","welding mig tig stick flux core blueprint metal aluminum stainless quality inspection osha"
"Carpenter","carpentry framing finish cabinet making woodworking blueprint tools renovation residential commercial safety"
"Machinist","machining cnc lathe mill blueprint tolerances gd&t quality inspection programming fanuc haas"
"Construction Worker","construction framing concrete masonry safety osha blueprint heavy equipment scaffolding site work"
"Industrial Mechanic","industrial maintenance mechanical hydraulics pneumatics preventive maintenance plc conveyor pump motor"
"Nonprofit Program Manager","program management grant management program evaluation stakeholder engagement budget impact community"
"Grant Writer","grant writing foundation government grants rfp proposal budget reporting stewardship research donor"
"Fundraising Manager","fundraising donor relations major gifts annual fund events board stewardship database salesforce campaign"
"Community Organizer","community organizing grassroots advocacy coalition canvassing voter registration training mobilization"
"Social Impact Analyst","social impact impact measurement theory of change data analysis program evaluation stakeholder reporting"
"NGO Project Manager","project management ngo international development logframe budget donor reporting monitoring evaluation"
"Strategy Consultant","strategy market analysis business development competitive analysis financial modeling excel powerpoint"
"IT Consultant","it consulting infrastructure cloud digital transformation erp sap oracle microsoft project management"
"Management Consulting Analyst","research data analysis excel powerpoint presentations financial modeling market sizing problem solving"
"Business Transformation Consultant","business transformation change management process improvement lean six sigma erp project management"
"Music Producer","music production daw logic pro ableton fl studio pro tools mixing mastering arrangement sound design"
"Sound Engineer","audio engineering pro tools logic pro mixing mastering recording foley post production dolby atmos"
"Sound Designer","sound design foley audio pro tools ableton field recording synthesis wwise fmod game audio film"
"Podcast Host","podcasting interviewing storytelling audio editing content strategy rss spotify apple podcasts marketing"
"Game Audio Designer","game audio wwise fmod sound design music implementation unity unreal adaptive music sfx"
"VFX Artist","visual effects nuke houdini maya 3ds max compositing particle effects simulation rendering film"
"Motion Graphics Designer","motion graphics after effects cinema 4d blender animation typography storyboard branding"
"Executive Assistant","executive support calendar management travel correspondence meeting management ms office zoom slack"
"Administrative Manager","office management administration budget vendor procurement hr coordination executive support ms office"
"Operations Analyst","operations process improvement data analysis excel sql reporting kpi project coordination lean"
"Executive Recruiter","executive search headhunting c-suite vp director sourcing assessment linkedin networking negotiation"
"Management Consultant","consulting strategy operations stakeholder excel powerpoint financial analysis recommendations client"
"Business Operations Manager","business operations process improvement efficiency kpi reporting budget vendor management project management"
